<?xml version="1.0" encoding="ISO-8859-1" ?>
<!DOCTYPE lager SYSTEM "lager.dtd">
<lager>

<eingang>
  <eingangsnummer>452</eingangsnummer>
  <artikelnummer>45-234</artikelnummer>
  <artikelname>Schreibtischstuhl "Chef"</artikelname>
  <artikelmenge>10</artikelmenge>
  <warenklasse>C-III</warenklasse>
</eingang>
<ausgang>
  <ausgangsnummer>318</ausgangsnummer>
  <artikelnummer>37-917</artikelnummer>
  <artikelname>Spiegelschrank  "Narziss"</artikelname>
  <artikelmenge>3</artikelmenge>
  <beschreibung>F-IV</beschreibung>
</ausgang>

</lager>

